{
  "$schema": "https://json-schema.org/draft/2020-12/schema",
  "$id": "ree://literature-evidence/v1/literature_evidence.schema.json",
  "title": "REE Literature Evidence v1",
  "type": "object",
  "required": [
    "schema_version",
    "literature_type",
    "entry_id",
    "timestamp_utc",
    "claim_ids_tested",
    "source",
    "evidence_class",
    "evidence_direction",
    "confidence",
    "confidence_rationale",
    "summary_path"
  ],
  "properties": {
    "schema_version": { "const": "literature_evidence/v1" },
    "literature_type": { "type": "string", "minLength": 1 },
    "entry_id": { "type": "string", "minLength": 1 },
    "timestamp_utc": { "type": "string", "format": "date-time" },
    "claim_ids_tested": {
      "type": "array",
      "items": { "type": "string" },
      "uniqueItems": true
    },
    "source": {
      "type": "object",
      "description": "Bibliographic provenance for the cited work. Declares three groups: descriptive fields (title/authors/year/venue), stable external identifiers (doi/pmid/pmc/pmcid/arxiv_id/isbn/url), and in-publication locators (volume/issue/pages). `additionalProperties` stays false on purpose, so this object is a record of the corpus's actual citation convention rather than a free-form bag. Two things deliberately do NOT belong here and are rejected: (a) denormalised renderings of fields already declared separately (a formatted `citation` string, a merged `volume_pages`), and (b) prose -- provenance notes, metadata corrections, retrieval caveats -- which belong in the entry's summary.md, the dominant corpus convention. An optional identifier may be null, meaning 'checked, none exists', which is more informative than omitting the key.",
      "required": ["title", "authors", "year"],
      "properties": {
        "title": { "type": "string" },
        "authors": {
          "type": "array",
          "items": { "type": "string" }
        },
        "year": { "type": "integer", "minimum": 1800, "maximum": 2200 },
        "venue": { "type": "string" },

        "doi": { "type": ["string", "null"], "description": "DOI, bare (no https://doi.org/ prefix)." },
        "pmid": { "type": ["string", "null"], "description": "PubMed ID, digits only. The primary verification handle for a biomedical source and the most-used identifier in this corpus after doi." },
        "pmc": { "type": ["string", "null"], "description": "PubMed Central ID, 'PMC'-prefixed. Synonym of `pmcid`; both are declared because both are already in use with identical value format. New entries should prefer `pmc`." },
        "pmcid": { "type": ["string", "null"], "description": "Deprecated spelling of `pmc`. Retained so existing entries validate; do not use in new entries." },
        "arxiv_id": { "type": ["string", "null"], "description": "arXiv identifier, e.g. '2307.07176'." },
        "isbn": { "type": ["string", "null"], "description": "ISBN for a book-form source, where no doi exists." },
        "url": { "type": ["string", "null"], "description": "Canonical link, for a source with no doi or other stable identifier." },

        "volume": { "type": ["string", "integer"], "description": "Journal volume. String or integer -- both spellings are already in use." },
        "issue": { "type": ["string", "integer"], "description": "Journal issue. String or integer -- both spellings are already in use." },
        "pages": { "type": "string", "description": "Page range, e.g. '338-347'." }
      },
      "additionalProperties": false
    },
    "evidence_class": { "type": "string" },
    "evidence_direction": {
      "type": "string",
      "enum": ["supports", "weakens", "mixed", "unknown"]
    },
    "confidence": { "type": "number", "minimum": 0, "maximum": 1 },
    "confidence_rationale": { "type": "string" },
    "summary_path": { "type": "string" },
    "failure_signatures": {
      "type": "array",
      "items": { "type": "string" },
      "uniqueItems": true
    },
    "tags": {
      "type": "array",
      "items": { "type": "string" }
    },
    "mapping": {
      "type": "object",
      "required": ["source_claim_statement", "ree_translation", "mapping_caveat"],
      "properties": {
        "source_claim_statement": { "type": "string" },
        "ree_translation": { "type": "string" },
        "mapping_caveat": { "type": "string" },
        "source_context": { "type": "string" }
      },
      "additionalProperties": false
    },
    "confidence_components": {
      "type": "object",
      "required": ["source_quality", "mapping_fidelity", "transfer_risk"],
      "properties": {
        "source_quality": { "type": "number", "minimum": 0, "maximum": 1 },
        "mapping_fidelity": { "type": "number", "minimum": 0, "maximum": 1 },
        "transfer_risk": { "type": "number", "minimum": 0, "maximum": 1 },
        "notes": { "type": "string" }
      },
      "additionalProperties": false
    }
  },
  "additionalProperties": false
}
